{
  "$schema": "https://json-schema.org/draft/2020-12/schema",
  "$id": "rdash-document.schema.json",
  "title": "Dashboard",
  "type": "object",
  "additionalProperties" : false,
  "properties": {
    "Title": {
      "required": true,
      "type": "string"
    },
    "Description": {
      "type": "string"
    },
    "ThemeName": {
      "required": true,
      "type": "string"
    },
    "CreatedWith": {
      "required": true,
      "type": "string"
    },
    "SavedWith": {
      "required": true,
      "type": "string"
    },
    "FormatVersion": {
      "required": true,
      "type": "integer"
    },
    "UseAutoLayout": {
      "required": true,
      "type": "boolean"
    },
    "Tags": {
      "type": "string"
    },
    "DataSources": {
      "required": true,
      "type": "array",
      "items": {
        "type": "any"
      }
    },
    "GlobalFilters": {
      "required": true,
      "type": "array",
      "items": {
        "type": "any"
      }
    },
    "GlobalVariables": {
      "required": true,
      "type": "array",
      "items": {
        "type": "any"
      }
    },
    "Widgets": {
      "required": true,
      "type": "array",
      "items": {
        "type": "any"
      }
    }
  }
}